"Tweet ID","Tweet Text","Type","Author Name","Author Username","Creation Time","Reply Count","Retweet Count","Quote Count","Like Count","View Count","Bookmark Count","Language","Possibly Sensitive","Source","Hashtags","Tweet URL","Media Type","Media URLs","External URLs"
"=""1815747420203938132""","Immediate former CS defence Aden Duale &amp; the Nominee to DOD CS Soipan Tuya had an encounter in May this year at Embakasi Garrison!","Tweet","Chris Sambu","the_sambu","7/23/2024, 4:54:54 PM","3","18","0","33","8392","3","en","No","Twitter for Android","","https://x.com/the_sambu/status/1815747420203938132","","",""
"=""1795769965162975521""","Every 4th Wednesday of the month Soldiers in all KDF installations as routine participate in tree growing activities. CS Defense Aden Duale lead the exercise at Embakasi Garrison with Environment CS Soipan Tuya.
KDF is specifically assigned to lead in Isiolo and Nakuru counties. https://t.co/zCDlDkZe01","Quoted tweet","Chris Sambu","the_sambu","5/29/2024, 1:51:38 PM","0","0","1","29","11330","3","en","No","Twitter Web App","","https://x.com/the_sambu/status/1795769965162975521","photo","https://pbs.twimg.com/media/GOvbQf7XwAArPfP.jpg, https://pbs.twimg.com/media/GOvbQgCXYAAYXje.jpg, https://pbs.twimg.com/media/GOvbQfzWAAA2k8J.jpg, https://pbs.twimg.com/media/GOvbQf-WYAEGc7H.jpg",""
"=""1816020591100469409""","@MillicentOmanga “Soipan Tuya doesn't deserve the misogynistic and sexualised vitriolic attacks on her character. The focus ought to be on her competence, track record, and capacity to deliver on the position she has been appointed to, not her private life”. 🤡🤡🤡🤡 https://t.co/NHxRUGpXMb","Reply","AFCKUNO_","AfcKuno_","7/24/2024, 11:00:23 AM","45","12","1","279","28943","6","en","No","Twitter for iPhone","","https://x.com/AfcKuno_/status/1816020591100469409","photo","https://pbs.twimg.com/media/GTPNGUwXsAAoNEO.jpg",""
"=""1811413976900682109""","Anything that paves the way for the best interest of our Nation, at this point in time, is preeminent. 

I most sincerely thank H.E The President @WilliamsRuto for the privilege, honor and opportunity to serve my country at the helm of the Environment, Climate Change and Forestry","Tweet","Hon. Soipan Tuya, E.G.H","HonTuya","7/11/2024, 5:55:21 PM","2086","705","377","5516","949136","95","en","No","Twitter for iPhone","","https://x.com/HonTuya/status/1811413976900682109","","",""
"=""1814317214662595001""","I take this opportunity to thank H.E. The President of the Republic of Kenya, @WilliamsRuto for granting me a second chance to serve our country in matters Environment, Climate Change and Forestry!

I wholly commit to serve with commitment &amp; dedication, upon confirmation.","Tweet","Hon. Soipan Tuya, E.G.H","HonTuya","7/19/2024, 6:11:47 PM","1672","397","231","3361","1240671","88","en","No","Twitter for iPhone","","https://x.com/HonTuya/status/1814317214662595001","","",""
"=""1913096296832946630""","Siuan Sanche é o nome dela, sapatao, filha de dois rios a ""NÃO queimada pois ela é a própria água."" Ela meio que divou!!!","Tweet","Lino 🍒","Danis_Beer","4/18/2025, 8:04:35 AM","1","0","0","2","417","1","pt","No","Twitter for Android","","https://x.com/Danis_Beer/status/1913096296832946630","","",""
"=""1912864164466294891""","SHE WAS JUST A FUCKING KID I HATE ALL OF YOU https://t.co/0whUm4kJbV","Quoted tweet","cerise loves siuan sanche","itsamydunne","4/17/2025, 4:42:10 PM","5","291","21","2332","37763","197","en","No","Twitter Web App","","https://x.com/itsamydunne/status/1912864164466294891","video","https://video.twimg.com/amplify_video/1912863978818347008/vid/avc1/960x720/G9UMJQy7MSzsJtOf.mp4?tag=14",""
"=""1586696603507003395""","tu is the definition of natural beauty, at the same time, cute and hot as hell💚😚✌🏻 #tontawan_t https://t.co/ruuoWDNs0T","Tweet","ᴬˢⁱᵃʰ | ia","userasiah","10/30/2022, 3:28:44 PM","3","35","0","191","","3","en","No","Twitter for iPad","#tontawan_t","https://x.com/userasiah/status/1586696603507003395","photo","https://pbs.twimg.com/media/FgUUJZGakAEtpQB.jpg",""
"=""1913871369864896758""","Soipan Tuya alitoa mimba ya Ruto😂😂😂😂😂😂😂😂😂😂😂😂😂😂😂😂😂😂😂😂😂😂😂😂😂😂😂😂😂😂😂😂😂😂😂😂😂😂😂😂😂😂😂😂😂😂😂😂😂😂😂😂😂😂😂😂😂😂😂😂😂😂😂😂😂😂😂😂😂😂😂😂🤣na aliitoa Nairobi hospital🤣🤣😂😂😂😂😂😂😂😂😂😂😂😂😂😂😂😂😂😂😂😂😂😂😂😂😂😂😂😂😂😂🙌","Tweet","Osiep Omanga","ImpeachBoth","4/20/2025, 11:24:27 AM","0","1","0","2","12","1","tl","No","Twitter for Android","","https://x.com/ImpeachBoth/status/1913871369864896758","","",""
"=""1213095742807642113""","Miren @SoyNewmanPerez cree haber descubierto quién es Tusi y busca amenazar con eso JAJAJA pobre idiota! Lo reté a dejar su cuenta abierta para que nuestros seguidores pudieran conocerlo mejor y se cagó
#CrippyBuscandoPeoATusi https://t.co/KHsksS1H4d","Tweet","Tusi Tan Rosa 🌹","tusitanrosa","1/3/2020, 4:52:17 PM","23","98","20","404","","0","es","No","Twitter for iPhone","#CrippyBuscandoPeoATusi","https://x.com/tusitanrosa/status/1213095742807642113","photo","https://pbs.twimg.com/media/ENXIGGoX0AA91GV.jpg, https://pbs.twimg.com/media/ENXIGGcWsAI9Nwo.jpg",""
"=""1600797778090680321""","Following executive directive to plant minimum of 200 trees at all official functions as we move from ‘planting’ to ‘growing’ trees at the Climate Change focused Kusi Ideas Festival with  @AnneWaiguru @ntvkenya and Global Center on Adaptation ED Patrick Verkooijen

@journeyto15B! https://t.co/13Jj2dCRql","Tweet","Hon. Soipan Tuya, E.G.H","HonTuya","12/8/2022, 1:21:46 PM","17","45","4","282","","1","en","No","Twitter for iPhone","","https://x.com/HonTuya/status/1600797778090680321","photo","https://pbs.twimg.com/media/FjctFjAWAAA7-hN.jpg, https://pbs.twimg.com/media/FjctFjAWAAE4BSC.jpg, https://pbs.twimg.com/media/FjctFi7WQAE1W89.jpg, https://pbs.twimg.com/media/FjctFi_XgAIdoHE.jpg",""
"=""1375658840201555978""","No me lo van a creer, pero ¡sí existe Teo Pai Pai! https://t.co/eNXq1xKGQX","Tweet","Sopitas","sopitas","3/27/2021, 7:00:00 AM","33","233","22","1859","","2","es","No","TweetDeck","","https://x.com/sopitas/status/1375658840201555978","photo","https://pbs.twimg.com/media/ExcdF0jW8AMqoD4.jpg, https://pbs.twimg.com/media/ExcdF0hWUAAOorM.jpg, https://pbs.twimg.com/media/ExcdF0lWEAEYpKN.jpg, https://pbs.twimg.com/media/ExcdF0kXMAAjBei.jpg",""
"=""1356985084298076163""","Según la leyenda, la «Virgen de Suyapa», cuya raíz indígena era Coyapa, que significa «en el agua de las palmeras», fue hallada el 3 de febrero de 1747 en la comunidad de El Piligüín, cerca del Real de Minas de Tegucigalpa. https://t.co/xB1K75nNxC","Tweet","yonny rodríguez","bucentauro_","2/3/2021, 6:17:10 PM","7","37","2","189","","2","es","No","Twitter for Android","","https://x.com/bucentauro_/status/1356985084298076163","photo","https://pbs.twimg.com/media/EtT6vh4WgAQvyb2.jpg",""
"=""929650366970339330""","ดูมือที่สัมผัสเต่าผ่านกระจกนะคะ...มันละมุนเหมือนเวลาที่น้องสัมผัสคริสเลยค่ะ...ขอโทษที่พี่ขี้ชิป 😊
(IG : yuyui) 
#sotusStheSeries 
#SingtoPrachaya https://t.co/87ow6JVnew","Reply","╰☆𝓟𝓪𝓽𝓬𝓱 ☆╮","SK_patch","11/12/2017, 1:01:34 PM","0","45","0","93","","0","th","No","Twitter for Android","#sotusStheSeries, #SingtoPrachaya","https://x.com/SK_patch/status/929650366970339330","video","https://video.twimg.com/ext_tw_video/929650159994093569/pu/vid/624x1280/Vd43FSkIXoiZSDMZ.mp4",""
"=""1814830481613201647""","🔞 #togasuo ""Good boy."" 

Hanya itu. Just say those words, dan Suo kejang-kejang keenakan abis ngeluarin cairan putih kental.

""AHH Hngh!!!"" 

Tubuhnya yang melengkung sempurna, lenguhan dan desahan yang ia keluarkan pagi itu membuat sang pelaku tersenyum puas. Lubang anal hingga","Tweet","Hinata☆Shoyo","souxminx","7/21/2024, 4:11:19 AM","1","165","6","1143","60503","381","in","No","Twitter for Android","#togasuo","https://x.com/souxminx/status/1814830481613201647","","",""
"=""967436162271911937""","สเปฯ คือดี อยากจะตีก้องภพ 
คือ หมั่นเขี้ยว ในความมั่นหน้ามากอ่ะค่ะ
😏😏😏😏😏😏😏😏😏😏
#SingtoPrachaya 
#sotusStheseries https://t.co/SRtbUxnDkL","Tweet","🌹📷 T U C K J A 🎬🌹","st_tuckja","2/24/2018, 7:28:49 PM","3","386","1","902","","0","th","No","Twitter for Android","#SingtoPrachaya, #sotusStheseries","https://x.com/st_tuckja/status/967436162271911937","photo","https://pbs.twimg.com/media/DW0GA1eVoAAlGIS.jpg, https://pbs.twimg.com/media/DW0GB5SVMAAMk_L.jpg, https://pbs.twimg.com/media/DW0GCi6U0AA5_y2.jpg, https://pbs.twimg.com/media/DW0GDY7U8AAFuvk.jpg",""
"=""1025895912030105601""","Los 11 niños rescatados, junto a su entrenador en la cueva de Tailandia rinden homenaje al buzo que perdió la vida por tratar de salvarlos con este noble gesto 📿🕉 https://t.co/pSkEVksI1j","Tweet","Sopitas","sopitas","8/5/2018, 3:07:00 AM","2","110","2","392","","1","es","No","Twitter Media Studio","","https://x.com/sopitas/status/1025895912030105601","video","https://video.twimg.com/amplify_video/1025440157883719680/vid/480x480/Wzg2sVEKsy1yyRnf.mp4?tag=7",""
"=""1760311987404177737""","Isla Teopán dentro del Lago Coatepque. 

Esta islita era sagrada para los Mayas, existía en ella un templo con un monolito representativo de la diosa Ixqueye.
Por lo que en algunos puntos de la isla se pueden observar petrograbados que evidencian la importancia de esta isla para https://t.co/8alleRrYzO","Tweet","Silvia..🇸🇻","Silvita_Sorian0","2/21/2024, 5:34:17 PM","20","27","1","201","8875","1","es","No","Twitter for iPhone","","https://x.com/Silvita_Sorian0/status/1760311987404177737","photo","https://pbs.twimg.com/media/GG3ibD6XkAAbGxs.jpg",""
"=""597896980321292288""","Estudiante se incendia en CU después de tomar Tonayan http://t.co/amRYQCoSsx http://t.co/82m4uSuQgX","Tweet","Sopitas","sopitas","5/12/2015, 1:52:03 AM","26","130","0","145","","0","es","No","TweetDeck","","https://x.com/sopitas/status/597896980321292288","photo","https://pbs.twimg.com/media/CEwigMiWMAEDSds.jpg","http://sopit.as/1cqWp8o"
"=""962692684031844355""","Sotus [อีเหนียนเซิง ซ่าง/เซี่ย] เวอร์ชันไต้หวัน สนพ.ไต้หวันซื้อไปขายพร้อมกันทั้งนิยายและซีรีส์ ฮิตมากๆ คนถามเพียบ นักอ่านไต้หวันอยากได้ภาษาไทย นี่ติดเล่มสองไปอ่านเอง แทบโดนฉก

#Taipeiinternationalbookfair #Sotus #sotusStheseries https://t.co/zb7tGaVRBL","Tweet","Theerapat Charoensuk","serapheter","2/11/2018, 5:19:56 PM","6","358","14","522","","0","th","No","Twitter for iPad","#Taipeiinternationalbookfair, #Sotus, #sotusStheseries","https://x.com/serapheter/status/962692684031844355","photo","https://pbs.twimg.com/media/DVwr5IcU8AMkt8d.jpg, https://pbs.twimg.com/media/DVwr5IPU8AA7suH.jpg, https://pbs.twimg.com/media/DVwr5FrVAAUYBWc.jpg, https://pbs.twimg.com/media/DVwr5GrU8AAeM_g.jpg",""
"=""1085473559386836993""","สำนักข่าว Tucknews เองค่ะ 555555
เป็นช่วงแย่งชิงตัวสิงของพี่ๆ นักข่าว ก็คือ เนื้อหอมอ่ะจ่ะ ช่วงรอสัมฯ ก็คุยกันเรื่องการแสดงของสิง ระหว่างโซตัสกับเฟรนโซน อ่อ ดูแล้วระวังด้วยนะคะ คุณจะหลงรักผู้ชายคนนี้เพิ่มขึ้นแน่ๆ หมั่นเขี้ยว วุ้ย!!! 😳😳😳 
#รักเธอนะสิง #SingtoPrachaya https://t.co/fYiMPMBzcK","Tweet","🌹📷 T U C K J A 🎬🌹","st_tuckja","1/16/2019, 12:47:18 PM","3","789","1","581","","19","th","No","Twitter for Android","#รักเธอนะสิง, #SingtoPrachaya","https://x.com/st_tuckja/status/1085473559386836993","video","https://video.twimg.com/ext_tw_video/1085473248853159937/pu/vid/720x1280/7dVkjZ-vCKYvxp97.mp4?tag=8",""
"=""1727293926191882317""","😆😆สุขภาพดี น่ารักสดใสร่าเริงไม่เคยเปลี่ยนเลยน้า แถมหล่อมากด้วยนะ😍🫠🤏🫰

Tofusan x Phuwin    

#TofusanHighProteinXPhuwin 
#phuwintang 

  2022                                              2023 https://t.co/oO8O4U7Lub","Tweet","Sompan ^_^™","Sompan95311183","11/22/2023, 2:52:18 PM","1","178","3","225","3883","10","th","No","Twitter for Android","#TofusanHighProteinXPhuwin, #phuwintang","https://x.com/Sompan95311183/status/1727293926191882317","photo","https://pbs.twimg.com/media/F_iUq26bcAAbEAD.jpg, https://pbs.twimg.com/media/F_iUrCibsAAdcNN.jpg",""
"=""1001981333189652480""","OJO: Imágenes tremendamente TIERNAS. La policía de Taiwán recluta cachorritos para su unidad antibombas 🐶 https://t.co/hArA2JOdmj https://t.co/yw2vqGdRCS","Tweet","Sopitas","sopitas","5/31/2018, 3:19:00 AM","19","97","18","582","","3","es","No","TweetDeck","","https://x.com/sopitas/status/1001981333189652480","photo","https://pbs.twimg.com/media/Deep2qJU0AACf-c.jpg","http://sopit.as/2skpAot"
"=""1823225930367783328""","When General Miguna Miguna says sth trust him. He says Soipan Tuya is President William Ruto's second wife and that's it.... Si ati ooooh

#RutoNaRailaMustGo https://t.co/25V7CA6cF0","Tweet","The Government Critic 🇰🇪","magwaz3","8/13/2024, 8:11:50 AM","22","214","2","453","19697","4","en","No","Twitter for Android","#RutoNaRailaMustGo","https://x.com/magwaz3/status/1823225930367783328","photo","https://pbs.twimg.com/media/GU1mUP-XYAEsagu.jpg",""
"=""1891571533023154194""","Soipan Tuya giving Oscar Sudi vibes in F1 and F4.

The results of putting any person in critical dockets just because of friendship and  not competency😂","Tweet","𝙱𝚛𝚒𝚊𝚗 𝙺𝚘𝚛𝚒𝚛","_Briankorir","2/17/2025, 10:32:51 PM","0","3","0","4","152","0","en","No","Twitter for Android","","https://x.com/_Briankorir/status/1891571533023154194","","",""
"=""1891542581881757720""","The Cabinet Secretary Defence, Hon. Soipan Tuya,visited Kahawa Garrison to familiarize herself with the operations of various formations and units based there, as well as their critical role in ensuring that KDF personnel are well-equipped to carry out their duties effectively. https://t.co/ZDnbOsEUjZ","Quoted tweet","Kenya Defence Forces","kdfinfo","2/17/2025, 8:37:49 PM","25","43","11","371","18504","9","en","No","Twitter for Android","","https://x.com/kdfinfo/status/1891542581881757720","photo","https://pbs.twimg.com/media/GkAb7nKXcAA6oy7.jpg, https://pbs.twimg.com/media/GkAb7qKXQAARblX.jpg, https://pbs.twimg.com/media/GkAb7o6W0AIPfp5.jpg, https://pbs.twimg.com/media/GkAb7nIWkAAM3JF.jpg",""
"=""1909637075453833272""","DEFENCE CS Soipan Tuya deploys KDF soldiers to Mombasa to assist in emergency response following the demolition of an 11-storey building.

Read more: https://t.co/ehPGRbhIPL https://t.co/MAfXs8tGH0","Tweet","Nation Africa","NationAfrica","4/8/2025, 6:58:52 PM","29","23","5","173","21870","2","en","No","Twitter Web App","","https://x.com/NationAfrica/status/1909637075453833272","photo","https://pbs.twimg.com/media/GoBgfVEWUAAT6f8.jpg","https://nation.africa/kenya/counties/mombasa/kdf-deployed-as-sinking-11-storey-mombasa-building-set-for-demolition-4995074"
"=""1903390885393420628""","Quest For Patriotic Values

Defense CS Soipan Tuya has criticised politicians and Kenyans for maligning the country's global image on social media, targeting key institutions that support Kenya and visiting foreign dignitaries.

#NTVAtOne @Karanja_Ibrah https://t.co/CfeUSa3ITb","Tweet","NTV Kenya","ntvkenya","3/22/2025, 1:18:45 PM","10","3","1","24","9091","0","en","No","Twitter Media Studio - LiveCut","#NTVAtOne","https://x.com/ntvkenya/status/1903390885393420628","video","https://video.twimg.com/amplify_video/1903388441775353856/vid/avc1/1280x720/ERfsQFNhr20ViHWD.mp4?tag=16",""
"=""1905276803230413043""","Today, on behalf of Defence Cabinet Secretary Hon. Soipan Tuya, I presided over the opening  of the 3rd Kenya Defence Forces (KDF) Medical Scientific Conference held at Ole Sereni Hotel, Nairobi.

The two day conference under the theme “Integrating Research and Innovation in https://t.co/3BxeSFCAPI","Tweet","Dr Patrick Mariru, PhD","pmariru","3/27/2025, 6:12:42 PM","1","1","0","11","373","0","en","No","Twitter for Android","","https://x.com/pmariru/status/1905276803230413043","photo","https://pbs.twimg.com/media/GnDnJLlXEAAvj67.jpg, https://pbs.twimg.com/media/GnDnJLlXMAAB2OE.jpg, https://pbs.twimg.com/media/GnDnJMFXsAAXyY1.jpg, https://pbs.twimg.com/media/GnDnJN7WwAA-g3W.jpg",""
"=""1909620385122824226""","Defence CS Soipan Tuya gazettes the deployment of KDF officers to assist in demolition of an eleven-storey building that begun sinking on 2nd April in Mombasa. https://t.co/r4UoH1E4Ng","Tweet","Kenya West","KinyanBoy","4/8/2025, 5:52:33 PM","1","1","0","4","742","0","en","No","Twitter for iPhone","","https://x.com/KinyanBoy/status/1909620385122824226","photo","https://pbs.twimg.com/media/GoBVnQ3XAAAh4FG.jpg",""
"=""1903382545380540506""","Defence CS Soipan Tuya has urged Kenyans to guard the peace of the country and not paint the nation in a negative way.
#starkenyanews https://t.co/Gu2daUdLlu","Tweet","TheStarKenya","TheStarKenya","3/22/2025, 12:45:36 PM","139","27","15","170","37535","5","en","No","Twitter Web App","#starkenyanews","https://x.com/TheStarKenya/status/1903382545380540506","photo","https://pbs.twimg.com/media/GmosSvdXQAEqcQF.jpg",""
"=""1914280454179721356""","Defence CS Soipan Tuya will tomorrow  launch a Counter Terrorism Financing and Money Laundering training in Nairobi organized by the Islamic Military Counter Terrorism Coalition.
#KBCniYetu ^RO https://t.co/LpM1fXVBVV","Tweet","KBC Channel 1 News","KBCChannel1","4/21/2025, 2:30:00 PM","1","0","0","1","563","0","en","No","Twitter Web App","#KBCniYetu","https://x.com/KBCChannel1/status/1914280454179721356","photo","https://pbs.twimg.com/media/GpC-aq5WMAA71-F.jpg",""
"=""1910325317677306231""","Today at Bunge Towers, together with Vice Chief of the Defence Forces Lt Gen John Omenda, we accompanied Defence Cabinet Secretary Hon. Soipan Tuya as she appeared before the Parliamentary Committee on Sports and Culture, chaired by Hon. Daniel Wanyama, MP for Webuye West.

We https://t.co/m9QahlUFUt","Tweet","Dr Patrick Mariru, PhD","pmariru","4/10/2025, 4:33:42 PM","1","2","0","5","322","0","en","No","Twitter for Android","","https://x.com/pmariru/status/1910325317677306231","photo","https://pbs.twimg.com/media/GoLWvaXWkAAsgmj.jpg, https://pbs.twimg.com/media/GoLWvahXwAA_9Tq.jpg, https://pbs.twimg.com/media/GoLWvaiWkAABejf.jpg, https://pbs.twimg.com/media/GoLWvbgWUAAzlis.jpg",""
"=""1910616098157822386""","Soipan Tuya: Government to spend 44.7 billion on Talanta Sports Complex   https://t.co/daf3pGHqNV","Tweet","Citizen TV Kenya","citizentvkenya","4/11/2025, 11:49:09 AM","246","83","41","602","84963","18","en","No","Twitter Web App","","https://x.com/citizentvkenya/status/1910616098157822386","","","https://www.citizen.digital/sports/government-to-spend-447-billion-on-talanta-sports-complex-n360853"
"=""1895555509794849146""","@kdfinfo Is it okay for Soipan Tuya to dress in military regalia?
Even the deputy president can't wear it.
Shame","Reply","𝙱𝚛𝚒𝚊𝚗 𝙺𝚘𝚛𝚒𝚛","_Briankorir","2/28/2025, 10:23:45 PM","5","1","0","36","2730","1","en","No","Twitter for Android","","https://x.com/_Briankorir/status/1895555509794849146","","",""
"=""1825604639175458917""","@AokoOtieno_ Tuambie kitu kuhusu Soipan Tuya","Reply","𝙱𝚛𝚒𝚊𝚗 𝙺𝚘𝚛𝚒𝚛","_Briankorir","8/19/2024, 9:43:58 PM","0","0","0","0","53","0","in","No","Twitter for Android","","https://x.com/_Briankorir/status/1825604639175458917","","",""
"=""1901647990315487260""","Cs Soipan Tuya : The Ministry of Defence urges Nation Media Group to uphold the principles of ethical journalism by ensuring accuracy, fairness and responsibility in reporting, especially on matters of national security https://t.co/xMZJg2RzNJ","Tweet","Goddie","Goddie_Ke","3/17/2025, 5:53:06 PM","7","12","0","138","5623","0","en","No","Twitter for Android","","https://x.com/Goddie_Ke/status/1901647990315487260","photo","https://pbs.twimg.com/media/GmQCwySWwAAWasC.jpg",""
"=""1904169516537614495""","Hosted members of the Senate Committee on National Security, Defence and Foreign Relations led by Chairperson Hon. Sen. @Fatuma_Dullo earlier today, for a courtesy visit at Ulinzi House.

We discussed means of engagement between the Ministry and the Senate for effective execution https://t.co/GmMgBGVwsq","Tweet","Hon. Soipan Tuya, E.G.H","HonTuya","3/24/2025, 4:52:45 PM","9","19","1","103","5269","1","en","No","Twitter for iPhone","","https://x.com/HonTuya/status/1904169516537614495","photo","https://pbs.twimg.com/media/Gmz2tQuaMAAfn4o.jpg, https://pbs.twimg.com/media/Gmz2tGxaoAAak_Q.jpg, https://pbs.twimg.com/media/Gmz2tQGWMAA2SJu.jpg, https://pbs.twimg.com/media/Gmz2tF-XQAAo9XI.jpg",""
"=""1904188414976499886""","Today, I attended a high-level security meeting between the Ministry of Defence and the Ministry of Interior and National Administration, chaired by Defence Cabinet Secretary Hon. Soipan Tuya at the Defence Headquarters. She was accompanied by Chief of the Defence Forces General https://t.co/bLMggsTLp9","Tweet","Dr Patrick Mariru, PhD","pmariru","3/24/2025, 6:07:50 PM","1","1","0","6","298","0","en","No","Twitter for Android","","https://x.com/pmariru/status/1904188414976499886","photo","https://pbs.twimg.com/media/Gm0JQ25XMAEiKcw.jpg, https://pbs.twimg.com/media/Gm0JQ34bcAA6TbG.jpg, https://pbs.twimg.com/media/Gm0JQ5ZaAAEeurg.jpg, https://pbs.twimg.com/media/Gm0JQ7GbUAA3fN-.jpg",""
"=""1897628743792783678""","Today, I accompanied Defence Cabinet Secretary Hon. Soipan Tuya to a follow up meeting with Prime Cabinet Secretary and Cabinet Secretary for Foreign and Diaspora Affairs, H.E. Musalia Mudavadi, at Railways Headquarters, Nairobi.

Building on our discussions from Monday, we https://t.co/IVM2cbmUEM","Tweet","Dr Patrick Mariru, PhD","pmariru","3/6/2025, 3:42:03 PM","1","3","0","7","3417","0","en","No","Twitter for Android","","https://x.com/pmariru/status/1897628743792783678","photo","https://pbs.twimg.com/media/GlW7RfbWAAA2030.jpg, https://pbs.twimg.com/media/GlW7RhvXIAAMn8d.jpg, https://pbs.twimg.com/media/GlW7RjNXAAA-Xul.jpg, https://pbs.twimg.com/media/GlW7RuzXwAAYZ7E.jpg",""
"=""1902617074666521066""","Defence CS Soipan Tuya: Deployment of June 25th is still in place and it’s in support of the police service https://t.co/CpvKlJFUZ4","Tweet","NTV Kenya","ntvkenya","3/20/2025, 10:03:54 AM","0","0","0","2","3607","1","en","No","Twitter Web App","","https://x.com/ntvkenya/status/1902617074666521066","video","https://video.twimg.com/ext_tw_video/1902616986976231424/pu/vid/avc1/720x800/xL8sMopxvfSyRoE6.mp4?tag=12",""
"=""1820082888185971128""","@KipngetichManu3 😂unatafta Soipan Tuya","Reply","🇰🇪","BlacKosgei","8/4/2024, 4:02:30 PM","0","0","0","0","25","0","es","No","Twitter for Android","","https://x.com/BlacKosgei/status/1820082888185971128","","",""
"=""1912799485874360748""","#VIETNAM: CS SOIPAN TUYA MEETS WITH VIETNAM PRESIDENT LƯƠNG CƯỜNG IN HANOI
Defence Cabinet Secretary Soipan Tuya, representing President William Ruto as a Special Envoy, has held talks with Vietnamese President Lương Cường in Hanoi.
The discussions took place during the 4th https://t.co/7P8lqZe0uW","Tweet","MwanzoTV","MwanzoTv","4/17/2025, 12:25:10 PM","0","0","0","0","231","0","vi","No","Twitter Web App","#VIETNAM","https://x.com/MwanzoTv/status/1912799485874360748","photo","https://pbs.twimg.com/media/Goug7hyWYAAbNIi.jpg, https://pbs.twimg.com/media/Goug7hYWcAAKFkk.jpg",""
"=""1862019027909894145""","@Gracenchoe Tunatuma ya Soipan Tuya pia😂","Reply","🇰🇪","BlacKosgei","11/28/2024, 9:21:45 AM","0","0","0","1","30","0","es","No","Twitter for Android","","https://x.com/BlacKosgei/status/1862019027909894145","","",""
"=""1815735057820103093""","Soipan Tuya's Knees must be hurting for praying too hard.. She keeps getting favored for big positions..","Tweet","Řõððïę","Its_Roddie","7/23/2024, 4:05:47 PM","8","58","0","249","3988","0","en","No","Twitter for Android","","https://x.com/Its_Roddie/status/1815735057820103093","","",""
"=""1642862341351002112""","1/2 Joined H.E. @WilliamsRuto, @CJMarthaKoome, @HonWetangula at the opening of the 3rd Regional Symposium on Greening Judiciaries in Africa themed; Strengthening the Role of Judiciaries in addressing Climate Change in Africa. https://t.co/KAh6Wysh6X","Tweet","Hon. Soipan Tuya, E.G.H","HonTuya","4/3/2023, 3:11:19 PM","9","28","1","213","11479","0","en","No","Twitter Web App","","https://x.com/HonTuya/status/1642862341351002112","photo","https://pbs.twimg.com/media/Fsyd3dhX0AMRDr-.jpg, https://pbs.twimg.com/media/Fsyd5nmXsAIrjcM.jpg, https://pbs.twimg.com/media/FsyeSI_XoAEBFsn.jpg",""
