"Tweet ID","Tweet Text","Type","Author Name","Author Username","Creation Time","Reply Count","Retweet Count","Quote Count","Like Count","View Count","Bookmark Count","Language","Possibly Sensitive","Source","Hashtags","Tweet URL","Media Type","Media URLs","External URLs"
"=""1813915357641392567""","High court has suspended Douglas Kanja's unconstitutional order banning protests in the country, https://t.co/cJ0G7PLeC8","Tweet","Oduk","_oduk","7/18/2024, 3:34:56 PM","43","1646","20","1990","33262","21","en","No","Twitter Web App","","https://x.com/_oduk/status/1813915357641392567","photo","https://pbs.twimg.com/media/GSxSJhxWgAAl4w-.png",""
"=""1868353257711763922""",""" Douglas Kanja who withdrew my security, I helped him to get the IG job,"" Rigathi Gachagua https://t.co/f48KxJ3tN6","Tweet","Jame","Cjamehk","12/15/2024, 8:51:43 PM","150","448","20","3991","139437","24","en","No","Twitter for Android","","https://x.com/Cjamehk/status/1868353257711763922","photo","https://pbs.twimg.com/media/Ge25YdnX0AAkA-G.jpg",""
"=""1849435891325944100""","My long time friend Inspector-Genaral Douglas Kanja…. https://t.co/VldhvCjqag","Tweet","Hon. Jaguar","RealJaguarKenya","10/24/2024, 4:00:52 PM","33","33","1","758","37139","2","en","No","Twitter for Android","","https://x.com/RealJaguarKenya/status/1849435891325944100","photo","https://pbs.twimg.com/media/GaqEI-4XIAAEFwZ.jpg, https://pbs.twimg.com/media/GaqEJByWwAAOvNx.jpg",""
"=""1837781227882877398""","Sir, Douglas Kanja! 

New Inspector General of Police 

Hapo @DCI_Kenya iko shida kubwa Sana!!

Wakenya Wengi are shocked, mortified and disgusted, what happened! 

We used to enjoy composition za Onomatopoeia as you fought crime 

Nowadays it's intimidation, abductions and...😞 https://t.co/LBppYGWUs8","Tweet","Maverick Aoko","AokoOtieno_","9/22/2024, 12:09:23 PM","77","466","9","1624","177101","127","en","No","Twitter for Android","","https://x.com/AokoOtieno_/status/1837781227882877398","video","https://video.twimg.com/ext_tw_video/1837781130675712000/pu/vid/avc1/576x1024/2EFGBViAMygO9gyP.mp4?tag=12",""
"=""1811750042329579622""","Douglas Kanja is the acting Inspector General of Police. https://t.co/OazhvkbMua","Tweet","Ole Teya","TeyaKevin","7/12/2024, 4:10:45 PM","7","92","0","606","12339","0","en","No","Twitter for Android","","https://x.com/TeyaKevin/status/1811750042329579622","photo","https://pbs.twimg.com/media/GSShD9kWcAAYBpL.jpg",""
"=""1872208107797201205""","Babu Owino: Now that the IG of police Douglas Kanja has distanced himself from the abductors, we will deal with them like gangsters. Kenyans are going to crush those criminals. We must #EndAbductionsKE https://t.co/CiTMil8VkK","Tweet","Cornelius K. Ronoh","itskipronoh","12/26/2024, 12:09:31 PM","262","3554","61","10103","302428","261","en","No","Twitter for iPhone","#EndAbductionsKE","https://x.com/itskipronoh/status/1872208107797201205","video","https://video.twimg.com/amplify_video/1872207906155712512/vid/avc1/364x640/-U6WLDYdZzXMRXXU.mp4?tag=16",""
"=""1811786932332220814""","AG, IG DOUGLAS KANJA TAKES OVER FROM THE FORMER IG JAPHET KOOME https://t.co/9ZCyf7zTlr","Tweet","National Police Service-Kenya","NPSOfficial_KE","7/12/2024, 6:37:20 PM","140","112","17","387","45547","3","en","No","Twitter for Android","","https://x.com/NPSOfficial_KE/status/1811786932332220814","photo","https://pbs.twimg.com/media/GSTCnNgWwAA_oX3.jpg",""
"=""1868620230907597056""","how the hell did douglas CRUSH THE METAL FRAMES https://t.co/EGkRggPFyK","Tweet","Kate 🍉 (NSFW DNI)","KJCents","12/16/2024, 2:32:34 PM","31","42","4","425","18430","47","en","No","Twitter Web App","","https://x.com/KJCents/status/1868620230907597056","photo","https://pbs.twimg.com/media/Ge6sKEhXQAApfsv.jpg",""
"=""1836047997588631824""","Congratulations, Douglas Kanja,  our New Inspector General of Police. https://t.co/agG9rfaaXB","Tweet","Abuga Makori EGH, MBE","abuga_makori","9/17/2024, 5:22:09 PM","26","64","0","1137","35119","3","en","No","Twitter for Android","","https://x.com/abuga_makori/status/1836047997588631824","photo","https://pbs.twimg.com/media/GXrz6zJX0AA4yIh.jpg",""
"=""1872518072067887386""","Mr Irungu,the Director of Amnsty kenya. Is this not you smiling with IG douglas kanja and his niece Wangu kanja who owns Wangu kanja foundation an organization for human rights? 

Hamuezi pigia IG simu??

Why are guys preaching water on one side and drinking alchohol on the other https://t.co/1nE5EtwuGU","Tweet","MethoDman","polo_kimanii","12/27/2024, 8:41:12 AM","57","1192","12","2719","59891","24","en","No","Twitter for iPhone","","https://x.com/polo_kimanii/status/1872518072067887386","photo","https://pbs.twimg.com/media/GfyFQgWXgAAIOIl.jpg",""
"=""1872315544394695122""","So
No witness statements
No family interviews
No crime scene dusting
No vehicle tracking
No CCTV analysis
No active investigations
No suspects
No leads
or any progress? 
Under international and Kenyan law, the state must not authorize, support or stand aside and watch others https://t.co/7g0oPtucbf","Quoted tweet","Irũngũ Houghton","irunguhoughton","12/26/2024, 7:16:26 PM","27","540","17","727","106233","19","en","No","Twitter for iPhone","","https://x.com/irunguhoughton/status/1872315544394695122","photo","https://pbs.twimg.com/media/GfvNDuMX0AAqxV1.jpg",""
"=""1836604878980026701""","''IG Douglas Kanja is 61 Years , he should retire!''- Hon Raphael Wanjala! https://t.co/LZ8oX0rNdt","Tweet","The Kenyan Vigilante","KenyanSays","9/19/2024, 6:15:00 AM","42","749","25","2154","97249","89","en","No","Twitter Web App","","https://x.com/KenyanSays/status/1836604878980026701","video","https://video.twimg.com/ext_tw_video/1836589975875325952/pu/vid/avc1/576x1024/BgFjFcNb1ihgtHUI.mp4?tag=12",""
"=""1865061735494795700""","20 Kenyan police of MSS invasion in Haiti submitted resignation letters, citing delayed pay &amp; difficult working conditions. According to 3 anonymous cops checks haven't been received since September despite Kenya police chief Douglas Kanja’s claims pay were up-to-date to October. https://t.co/9YYWnHPNsq","Tweet","Bettinna ⚔️ 🇭🇹","bettinna","12/6/2024, 6:52:23 PM","7","18","7","45","8166","3","en","No","Twitter Web App","","https://x.com/bettinna/status/1865061735494795700","photo","https://pbs.twimg.com/media/GeIGhtTWsAE-xII.jpg",""
"=""1836712798212006320""","Masengeli is now apologizing to Judge Mugambi after he's lost his TEMPORARY position 😂

New IG, Sir Douglas Kanja, your lofty assignment which will be your legacy

Is to restore Trust btwn Police and Citizens 

As it stands, TUNAWACHUKIA kabisa, sio Siri 

Utumishi kwa Wachache https://t.co/5ZgB7boFYS","Tweet","Maverick Aoko","AokoOtieno_","9/19/2024, 1:23:50 PM","171","468","7","2410","70724","12","en","No","Twitter for Android","","https://x.com/AokoOtieno_/status/1836712798212006320","photo","https://pbs.twimg.com/media/GX1QjleXAAAV2Uq.jpg",""
"=""1813946036068479020""","My friend @DouglasLwangaUg came by recently and we had a conversation covering so many topics including his career in the media, Purple Skills Klinic, love, marriage, the music industry etc. It’s up on my YouTube channel so check it out. Thank you @DouglasLwangaUg , it was so https://t.co/M2KgLHKS4x","Tweet","JULIANA KANYOMOZI","JKanyomozi","7/18/2024, 5:36:51 PM","13","31","2","299","22964","4","en","No","Twitter for iPhone","","https://x.com/JKanyomozi/status/1813946036068479020","video","https://video.twimg.com/amplify_video/1813945306309939200/vid/avc1/1280x720/nKPcZDsofPYQwNSh.mp4?tag=14",""
"=""1861486906296377607""","IG DOUGLAS KANJA VISIT NGONG AND LANG'ATA POLICE STATIONS https://t.co/TI4vAnQx6o","Tweet","National Police Service-Kenya","NPSOfficial_KE","11/26/2024, 10:07:17 PM","25","28","2","515","55296","3","tl","No","Twitter for Android","","https://x.com/NPSOfficial_KE/status/1861486906296377607","photo","https://pbs.twimg.com/media/GdVUdp-WMAAQLCg.jpg",""
"=""1872206826777010222""","IG Douglas Kanja has allowed Kenyans to arrest goons who are tarnishing image of the NPS and hand over to Police.

Note; Section 34 of Criminal Procedure Code CAP 75; private person may arrest any person who in his/her view commits a cognizable offence and handover to Police. https://t.co/JSI24yMojt","Tweet","Barry Ipapoh","BarryIpapo","12/26/2024, 12:04:26 PM","2","24","3","33","1548","2","en","No","Twitter for Android","","https://x.com/BarryIpapo/status/1872206826777010222","photo","https://pbs.twimg.com/media/GftqLenX0AA_7dU.jpg",""
"=""1873738730164392244""","In a High Court Petition filed by the Law Society of Kenya wherein I was instructed , The High Court has Today 30/12/2024 ordered the IG Douglas Kanja to personally produce the 2nd – 7th Petitioners/Applicants before
the High Court tomorrow in court at 11.00 am @FaithOdhiambo8 https://t.co/12Nl8Ydp4H","Tweet","Top City Lawyer","advabner","12/30/2024, 5:31:40 PM","3","57","3","109","5302","3","en","No","Twitter for iPhone","","https://x.com/advabner/status/1873738730164392244","photo","https://pbs.twimg.com/media/GgDba-hWwAAqL9G.jpg, https://pbs.twimg.com/media/GgDba-oWsAEcUs5.jpg",""
"=""1825827978128785757""","That's Douglas Kanja number, ask him how a person who confessed to killing people and dumped body at Kware escaped from a police station? Or he scripted the confession also? https://t.co/bauxHdXzeK","Tweet","The Government Critic 🇰🇪","magwaz3","8/20/2024, 12:31:26 PM","18","129","3","227","8458","6","en","No","Twitter for Android","","https://x.com/magwaz3/status/1825827978128785757","photo","https://pbs.twimg.com/media/GVak3quXAAAvze8.jpg",""
"=""1813075507707060319""","Today is a big test for Acting police IG Douglas Kanja in handling any protests that will happen.","Tweet","Chris Sambu","the_sambu","7/16/2024, 7:57:41 AM","13","393","4","881","16933","5","en","No","Twitter for Android","","https://x.com/the_sambu/status/1813075507707060319","","",""
"=""1848668207302770906""","Like Kabarak

William Ruto is building and international school in Uasin Gishu

Supreme Court #MainaAndKingangi #UnderstandingSHA Universal Healthcare Milimani Law Courts Ruto Prism In Kenya KCSE High Court John Chebochok IG Douglas Kanja Farouk Kibet The SHA #GachaguaTheLiar https://t.co/OEazWsBZ4N","Tweet","paul okonji","paul_okonji","10/22/2024, 1:10:21 PM","9","14","0","59","76304","13","en","No","Twitter for Android","#MainaAndKingangi, #UnderstandingSHA, #GachaguaTheLiar","https://x.com/paul_okonji/status/1848668207302770906","photo","https://pbs.twimg.com/media/GafE8caXoAAXOC0.jpg, https://pbs.twimg.com/ext_tw_video_thumb/1848667898404917249/pu/img/sBECh7PInpsjMlSi.jpg",""
"=""1824044474772623806""","Guys, ndio hii number ya Douglas Kanja , send him everything you can including photos of killer police men and the people they killed, also, msalimieni and tell him we meet on 27th, 

#DissolveParliament https://t.co/ifnudLrWFe","Tweet","Oduk","_oduk","8/15/2024, 2:24:26 PM","2","445","1","476","10794","16","en","No","Twitter for Android","#DissolveParliament","https://x.com/_oduk/status/1824044474772623806","photo","https://pbs.twimg.com/media/GVBOyFBXEAAcH6P.jpg",""
"=""1824027651675169020""","Douglas Kanja: I will do whatever it takes to ensure Parliament is safe and secure. I must appreciate police officers for operating under difficult circumstances during the anti-government demonstrations https://t.co/UMF5svVyJp","Quoted tweet","Citizen TV Kenya","citizentvkenya","8/15/2024, 1:17:35 PM","109","41","25","213","69371","12","en","No","Twitter Media Studio - LiveCut","","https://x.com/citizentvkenya/status/1824027651675169020","video","https://video.twimg.com/amplify_video/1824026890492887040/vid/avc1/1920x1080/o9xQae_ShtgMxA4q.mp4?tag=16",""
"=""1873746062068064546""","High Court orders Inspector General of Police Douglas Kanja to produce abducted youth by 11 a.m tomorrow at Milimani Law Courts https://t.co/lSYLS1kBAh","Tweet","The Eastleigh Voice","Eastleighvoice","12/30/2024, 6:00:48 PM","0","166","0","257","4018","1","en","No","Twitter Web App","","https://x.com/Eastleighvoice/status/1873746062068064546","photo","https://pbs.twimg.com/media/GgDiGz5WUAAe2pa.jpg",""
"=""1816436117199081879""","President William Ruto has nominated Douglas Kanja as the Inspector General of Police","Tweet","Moe","moneyacademyKE","7/25/2024, 2:31:32 PM","18","498","5","1682","113026","9","en","No","Twitter Web App","","https://x.com/moneyacademyKE/status/1816436117199081879","","",""
"=""1864630629393936642""","VIDEO: Police IG Douglas Kanja and DCI boss Mohamed Ibrahim Amin say the police service has acted on the harassment of Citizen journalist Agnes Oloo by a DCI officer and apologised over the incident.

""We have some officers who are overzealous and this is an issue we have https://t.co/zksVGvY7uf","Tweet","The Eastleigh Voice","Eastleighvoice","12/5/2024, 2:19:19 PM","10","6","1","14","5552","6","en","No","Twitter Web App","","https://x.com/Eastleighvoice/status/1864630629393936642","video","https://video.twimg.com/ext_tw_video/1864629539378249728/pu/vid/avc1/1280x720/4t0k3alH9U7NHVwz.mp4?tag=12",""
"=""1872167276847476861""","For avoidance of doubt, NPS is not involved in any abductions and there is NO police station in the country that is holding the reported abductees.
- IG Douglas Kanja 
(Now you know who are doing abductions) https://t.co/0EIPjZqciz","Tweet","Barry Ipapoh","BarryIpapo","12/26/2024, 9:27:16 AM","4","18","1","24","1545","0","en","No","Twitter for Android","","https://x.com/BarryIpapo/status/1872167276847476861","photo","https://pbs.twimg.com/media/GftGNMAWgAA0meF.jpg",""
"=""1836990492862546423""","There is a message that IG Douglas Kanja and DG Amin Mohammed have been trying to pass across. Both during Kware dam killings and recent abductions.

'We don't abduct people' or 'we don't have Kitengela 3'  

i.e There are abductions and someone somewhere does it. https://t.co/JMVCT4ibIF","Quoted tweet","Barry Ipapoh","BarryIpapo","9/20/2024, 7:47:17 AM","11","61","6","97","20802","8","en","No","Twitter Web App","","https://x.com/BarryIpapo/status/1836990492862546423","photo","https://pbs.twimg.com/media/GX5MQ0oX0AAS7I7.jpg",""
"=""1871409340013498558""","VIDEO: Martha Karua accuses the government of conducting abductions, alleging that President Ruto directly orders the kidnapping of young men through a specialised squad that reports to him. However, Police IG Douglas Kanja refuted the claims. 

📹: Citizen TV https://t.co/YTtqJYy9Kt","Tweet","The Eastleigh Voice","Eastleighvoice","12/24/2024, 7:15:30 AM","0","57","5","74","4673","4","en","No","Twitter Web App","","https://x.com/Eastleighvoice/status/1871409340013498558","video","https://video.twimg.com/ext_tw_video/1871408080908394496/pu/vid/avc1/1280x720/MTpZ-tPzARtIGG22.mp4?tag=12",""
"=""1813661324469276778""","In a  statement by police, Acting inspector general Douglas Kanja has Banned any sort of protests in Nairobi. The statement technically seeks to state that anyone found in Nairobi CBD purporting to Demonstrate will be treated &amp; handled as a criminal. The statement gives the https://t.co/NPVRd36isP","Tweet","Chris Sambu","the_sambu","7/17/2024, 10:45:30 PM","13","52","12","100","13544","6","en","No","Twitter for Android","","https://x.com/the_sambu/status/1813661324469276778","photo","https://pbs.twimg.com/media/GStrXKRW4AAwP9O.jpg",""
"=""1868594261643723077""","""Inspector of police Douglas Kanja, wewe unajua hao watu walitupiga picha zao ziko why have you not arrested and taken them to court?""- Gachagua https://t.co/qirwd0N42l","Tweet","K24 TV","K24Tv","12/16/2024, 12:49:23 PM","17","165","3","736","77457","25","en","No","Twitter Media Studio","","https://x.com/K24Tv/status/1868594261643723077","video","https://video.twimg.com/amplify_video/1868594022924644352/vid/avc1/720x720/j-vlvzuPpASmmMpu.mp4?tag=14",""
"=""1814364307838353873""","The National Police service now says they did not Ban protests. Further stating that planning must include a leader who must provide full names and Physical address! Acting inspector general Douglas Kanja says they respect the court order &amp; Article 37. https://t.co/2uqvLEkkPl","Tweet","Chris Sambu","the_sambu","7/19/2024, 9:18:54 PM","13","25","7","82","14960","6","en","No","Twitter for Android","","https://x.com/the_sambu/status/1814364307838353873","photo","https://pbs.twimg.com/media/GS3quKqXwAApMrL.jpg",""
"=""1816455314843021422""","Congratulations to our new Inspector General of Police my friend Douglas Kanja. You have proven yourself as a dependable and reliable officer, all the best as you serve our great Nation Kenya. https://t.co/iMfpvAxlc9","Tweet","Kanini Kega, CBS","kaninikega1","7/25/2024, 3:47:49 PM","30","37","4","460","26419","2","en","No","Twitter for Android","","https://x.com/kaninikega1/status/1816455314843021422","photo","https://pbs.twimg.com/media/GTVYeHpXIAAKBj1.jpg, https://pbs.twimg.com/media/GTVYecHXAAAg1T9.jpg, https://pbs.twimg.com/media/GTVYdbfWsAA_Fom.jpg",""
"=""1868346496464388173""","Police IG Douglas Kanja does not pick my calls yet I'm the one who gave him that job-Former Deputy President Rigathi Gachagua https://t.co/BNnewWorp2","Tweet","Kaslim","TheKaslim","12/15/2024, 8:24:51 PM","22","59","4","508","19953","0","en","No","Twitter for Android","","https://x.com/TheKaslim/status/1868346496464388173","photo","https://pbs.twimg.com/media/Ge2zPImXgAIQNBr.jpg",""
"=""1824043723225018851""","Inspector General of Police nominee Douglas Kanja has in the past admitted that he doesn’t have a degree, a key requirement to be an IG as per the law but parliament will anyways approve him. They are a rubber stamp for Zakayos regime.","Tweet","Cyprian, Is Nyakundi","C_NyaKundiH","8/15/2024, 2:21:27 PM","69","1218","9","2827","68872","25","en","No","Twitter for iPhone","","https://x.com/C_NyaKundiH/status/1824043723225018851","","",""
"=""1872834902779150367""","LSK calls for police IG Douglas Kanja to resign, saying he has failed to protect Kenyans.

They added that his statement denying police involvement in enforced disappearances was underwhelming","Tweet","Moe","moneyacademyKE","12/28/2024, 5:40:11 AM","8","1279","3","3532","57288","14","en","No","Twitter Web App","","https://x.com/moneyacademyKE/status/1872834902779150367","","",""
"=""1824037540711530855""","Police Inspector General nominee Douglas Kanja cornered with tough questions during his vetting; Kenyans divided on his suitability.  

What do you think on his responses? And suitability?

Watch thread of vetting highlights and decide👇👇 https://t.co/IahuYXZiVf","Tweet","Mambo Mseto X","MamboMseto254","8/15/2024, 1:56:53 PM","81","95","1","252","104237","51","en","No","Twitter Web App","","https://x.com/MamboMseto254/status/1824037540711530855","photo","https://pbs.twimg.com/media/GVBFh6jWIAAWNdH.jpg",""
"=""1836837356973809698""","HIS EXCELLENCY THE PRESIDENT DR. WILLIAM RUTO INSTALS DOUGLAS KANJA AS THE INSPECTOR GENERAL OF POLICE https://t.co/CMSrPrFArQ","Tweet","National Police Service-Kenya","NPSOfficial_KE","9/19/2024, 9:38:47 PM","78","44","5","277","22079","3","en","No","Twitter for Android","","https://x.com/NPSOfficial_KE/status/1836837356973809698","photo","https://pbs.twimg.com/media/GX3BXMmWYAAglY4.jpg, https://pbs.twimg.com/media/GX3BXMmXcAAxaBH.jpg, https://pbs.twimg.com/media/GX3BXMfWgAAPKj_.jpg, https://pbs.twimg.com/media/GX3BXMiWUAAhbq7.jpg",""
"=""1868276173169435036""","Former Dp Rigathi Gachagua : One day, Police IG Douglas Kanja, You Will Answer Why You Never Arrested Those Who Wanted to Kill Me
 https://t.co/YDJKtMcL3Z https://t.co/F56GeBW3d0","Tweet","Goddie","Goddie_Ke","12/15/2024, 3:45:25 PM","32","522","8","3134","71530","7","en","No","Twitter for Android","","https://x.com/Goddie_Ke/status/1868276173169435036","photo","https://pbs.twimg.com/media/Ge1zRRwWAAIUZBG.jpg","https://julisha.co.ke/articles/read?ArticleID=1734266032574Former-DP-Rigathi-Gachagua-Warns-Police-IG-Douglas-Kanja&PublishedDate=1734266032574"
"=""1814367298980839572""","Acting IG Douglas Kanja Makes a 360 turn and says he did not ban Peaceful Demonstrations after the High Court Ruling.

COMRADES DOES THE PRESSURE INCREASES OR DECREASES?","Tweet","EDGAR 🇰🇪","edgarwabwire_","7/19/2024, 9:30:48 PM","64","1111","8","2465","28523","6","en","No","Twitter for Android","","https://x.com/edgarwabwire_/status/1814367298980839572","","",""
"=""1851998813961035776""","NATIONAL HUMAN rights defender KNCHR wants IG Douglas Kanja, other police chiefs held accountable for rising abductions, extra-judicial killings; demands a stop to abuses. https://t.co/JzVHjFaTF2","Tweet","Nation Africa","NationAfrica","10/31/2024, 5:45:00 PM","17","854","7","2402","73965","16","en","No","Later Media","","https://x.com/NationAfrica/status/1851998813961035776","photo","https://pbs.twimg.com/media/GbOe-JgXwAAEyB6.jpg",""
"=""1837004510675304644""","Kanja comes from the same hood as Gachagua, 

That's why they took their sweet time to confirm him as IG, 

They wanted that court abscondee , Masechietha, 

But the heat became too much especially with abductions and his arrogance 

Tebu amalizane na Mugambi arudi kichaka https://t.co/nYI2uVAih5","Tweet","Maverick Aoko","AokoOtieno_","9/20/2024, 8:42:59 AM","125","377","4","2262","208980","30","en","No","Twitter for Android","","https://x.com/AokoOtieno_/status/1837004510675304644","photo","https://pbs.twimg.com/media/GX5Z3dgXgAAw6ZH.jpg",""
"=""1872176238409994320""","Douglas Kanja is trying to say,

That an individual is running a secretive abductions squad,

Without the knowledge of NIS and DCI.

And you people still say that we have a country.

#EndAbductionsKE #RutoMustGo","Tweet","I am Chege","_James041","12/26/2024, 10:02:53 AM","27","473","4","914","10689","4","en","No","Twitter for Android","#EndAbductionsKE, #RutoMustGo","https://x.com/_James041/status/1872176238409994320","","",""
"=""1824093847460204951""","Have just watched the interview of one Douglas Kanja na nakuambia huyu sasa ndo cabbage kabisa. https://t.co/QNZZl5dqUz","Tweet","The Government Critic 🇰🇪","magwaz3","8/15/2024, 5:40:37 PM","34","57","0","219","4562","2","tl","No","Twitter for Android","","https://x.com/magwaz3/status/1824093847460204951","photo","https://pbs.twimg.com/media/GVB7rAmWsAAGtAv.jpg",""
"=""1836666964359389691""","The New Inspector General of Police Douglas Kanja is past 60, Ruto said that all public servants must retire at the age of 60. Why was he appointed? #RutoMustGo https://t.co/Xqt9nTf3Cn","Tweet","The Government Critic 🇰🇪","magwaz3","9/19/2024, 10:21:42 AM","78","131","2","245","4793","2","en","No","Twitter for Android","#RutoMustGo","https://x.com/magwaz3/status/1836666964359389691","photo","https://pbs.twimg.com/media/GX0m3pwXMAANO9I.jpg",""
"=""1838875880656920576""","HIGH COURT certifies as urgent petition seeking removal of IG Douglas Kanja; Senator Omtatah claims he was handpicked. https://t.co/YHkziv2p1y https://t.co/DIITUbN0iz","Tweet","Nation Africa","NationAfrica","9/25/2024, 12:39:09 PM","60","1137","33","3077","105356","31","en","No","Twitter Web App","","https://x.com/NationAfrica/status/1838875880656920576","photo","https://pbs.twimg.com/media/GYT-dAUXcAAnq68.jpg","https://nation.africa/kenya/news/politics/high-court-upholds-urgent-petition-to-recall-ig-douglas-kanja-4774718"
"=""1868337132143812854""","Police IG Douglas Kanja does not pick my calls yet I'm the one who gave him that job- Rigathi Gachagua","Tweet","Gachambi Nderitu","GachambiNderit2","12/15/2024, 7:47:38 PM","16","17","0","90","5040","0","en","No","Twitter for Android","","https://x.com/GachambiNderit2/status/1868337132143812854","","",""
"=""1872202109518598561""","Now that the IG Douglas Kanja has confirmed that they’re not holding several young men who were abducted few days ago for criticizing President Ruto and his government. Is it time to activate community vigilance and react to the gangs/militias who are abducting our people? https://t.co/TB0hG36NSc","Tweet","Ni Hulius!","Hulius_","12/26/2024, 11:45:41 AM","4","26","1","48","5781","0","en","No","Twitter for Android","","https://x.com/Hulius_/status/1872202109518598561","photo","https://pbs.twimg.com/media/Gftl40iW0AAyfXF.jpg",""
"=""1868358031228236179""","Former Deputy President Rigathi Gachagua slams police IG Douglas Kanja for withdrawing his security and failing to prevent Limuru chaos. https://t.co/9hee1F5bMp","Tweet","Mambo Mseto X","MamboMseto254","12/15/2024, 9:10:41 PM","47","38","0","56","2317","0","en","No","Twitter Web App","","https://x.com/MamboMseto254/status/1868358031228236179","photo","https://pbs.twimg.com/media/Ge29sj6WEAAWqE7.jpg",""
"=""1866823198416720300""","Following public outcry and condemnation from civil society and female leaders, Inspector General of Police, Douglas Kanja has directed the Director of the Internal Affairs Unit to launch an immediate inquiry into the unnecessary force used by police officers to disperse peaceful https://t.co/hVcSY4CipC","Tweet","The Eastleigh Voice","Eastleighvoice","12/11/2024, 3:31:49 PM","5","9","1","18","1668","1","en","No","Twitter Web App","","https://x.com/Eastleighvoice/status/1866823198416720300","photo","https://pbs.twimg.com/media/GehJyZaXIAA6HUJ.jpg",""
"=""1836772902307353076""","The rule of law is the bedrock of our democracy. We must obey and submit to it for the stability of our country. We will continue supporting our security agencies to keep Kenya safe and secure.

During the investiture of rank to the Inspector General of Police Douglas Kanja, https://t.co/oRnJrfZEbT","Tweet","William Samoei Ruto, PhD","WilliamsRuto","9/19/2024, 5:22:40 PM","466","140","25","960","103910","14","en","No","Twitter for iPhone","","https://x.com/WilliamsRuto/status/1836772902307353076","photo","https://pbs.twimg.com/media/GX2HNWzWQAAZTaD.jpg, https://pbs.twimg.com/media/GX2HNWqXwAA7SBa.jpg, https://pbs.twimg.com/media/GX2HNZnXcAAOWQL.jpg, https://pbs.twimg.com/media/GX2HNWlXMAAVd53.jpg",""
